,Verse,B1,P3,To,W1,Normalized
360,415,Non leue pondus habet uiolenta Cupidinis arma,Non leue pondus habent uiolenta Cupidinis arma,Non leue uulnus habet uiolenta Cupidinis arma,Non leue dant uulnus uiolenta Cupidinis arma,grimm vápn ástargyðju hafa ei létt sár
361,416,Hijs male seduci queque puella timet,Hijs male seduci queque puella timet,Hijs male subduci queque puella timet,Hijs male seduci queque puella timet,þau vápn óttask hver mǽr illa at svíkjask
362,417,Sepius immeritas incusat fama puellas,Sepius immeritas accusat fama puellas,Sepius immeritas incusat fama puellas,Sepius immeritas incusat fama puellas,oft rǿgir frǽgð með lygi óverðugar meyjar
363,418,Omnia nec cessat carpere liuor edax,Omnia non cessat carpere liuor edax,Omnia non cessat capere liuor edax,Omnia non cessat carpere liuor edax,etandi ǫfund léttir ei allt at grípa
364,419,Quo petis annuerem fame nisi uerba timerem,Quod petis annuerem fame nisi uerba timerem,Quod petis annuerem fame nisi uerba timerem,Quod petis annuerem nisi fame uerba timerem,játa mynda ek því er þú beiðisk ef ek hrǽddumsk ei vǫrðu
365,42,Tela nec inde queo ui remouere mea,Tela nec inde queo ui remouere mea,Tela nec inde queo ui remouere mea,Tela nec inde queo ui remouere mea,ok þau vápn má eigi þaðan fǿra með mínu afli
366,420,Que magis in tali crimine lumen,Que magis in tali crimine lumen,Que magis in tali crimine lumen,Que magis in tali crimine lumen,
367,421,Rebus in is maior nimis est infamia uero,Rebus in hijs maior nimis est infamia uero,Rebus - - maior nimis est infamia uero,Rebus in hijs maior nimis est infamia uero,Allmjǫk er slíkt orð látit ríkari sannendi
368,422,Sed prestat uerum rumor et ipse cadit,Sed prestat uerum rumor et ipse cadit,Sed prestat rerum rumor et ipse cadit,Sed prestat uerum rumor et ipse cadit,ok ef sátt er uppi
369,423,Murmura rumoris curasque leuabo timoris,Murmura rumoris curas removebo timoris,Murmura rumoris curasque leuabo timoris,Murmura rumoris curasque leuabo timoris,ek mun með hófi frǽgð ok hrǽzlu leggja
370,424,Vos uestrosque iocos calliditate tegam,Vos uestrosque iocos calliditate tegam,Vos uestrosque iocos calliditate tegam,Vos uestrosque iocos calliditate tegam,ok ykkr með lǽvísi leyna ok ykkarn leik
371,425,Nam Veneris mores cognoscimus eius et artes,Nam Veneris mores cognoscimus eius et artes,Nam Veneris mores cognoscimus eius et artes,Nam Veneris mores cognoscimus eius et artes,"því at vér kunnum vel hans lostavenju
"
372,426,Et sic tuta meo res erit ingenio,Et sic tuta meo res erit ingenio,Et sic tuta meo rei erit ingenio,Et sic tuta meo res erit ingenio,ok sá mun hlutr øruggr vera með mínu ráði
373,427,Illum cum uideam michi consule quid sibi dicam,Illum cum uideo michi consule quid sibi dicam,Illum cum uideam michi consule quid sibi dicam,Illum cum uideam michi consule quid sibi dicam,en þá er ek sé hann ráð mér hvat ek skal segja
374,428,Que michi predices tucius ipsa loquar,Quod michi predices tucius ipsa loquar,Que michi predices tucius ipsa loquar,Que michi predices tucius ipsa loquor,þá mun ek djarfliga mǽla þat er þú hefir rǿtt fyrir mér
375,429,Nescio uelle meum tibi secretumque fateri,Hesito uelle meum tibi secretumque fateri,Hesito uelle meum tibi secretumque fateri,Nescio uelle meum tibi secretumque fateri,Ifask mjǫk vili minn leynda hluti mína þér at segja
376,43,Vulneris inde crescit dolor annibus horis amanti,Vulneris inde mei crescit dolor annibus horis,Vulneris inde mei crescit dolor annibus horis,Vulneris inde mei crescit dolor annibus horis,fyrir sakar sárs míns Harmr vex ǽ jafnan í ǫllum tíðum
377,430,Nam dolus insidias tendit ubique suas,Nam dolus insidias tendit ubique suas,Nam dolus insidias tendit ubique suas,Nam dolus insidias tendit ubique suas,
378,431,Sed tamen experiar que sit tua lingua fidesque,Sed tamen experiar que sit tua lingua fidesque,Sed tamen experiar que sit tua lingua fidesque,Sed tamen experiar que sit tua lingua fidesque,en þó skal ek reyna hvárt tunga þín sé trú eða eigi
379,432,Et qua parte tuum me trahat ingenium,Et qua parte tuum me trahat ingenium,Et qua parte tuum me trahat ingenium,Et qua parte tuum me trahat ingenium,ok svá til hvers dregr mik þín rǿða
380,433,Pamphilus ipse meum pecijt michi nuper amorem,Pamphilus ille meum pecijt sibi nuper amorem,Pamphilus ipse meum sibi petiturus nuper amorem,Pamphilus ipse meum pecijt sibi nuper amorem,Pamphilus beiðisk ástar minnar
381,434,Nos simul et uera iunxit amicicia,Nos simul et uera iunxit amicicia,Nos simul et uera iunxit amicicia,Nos simul et uera iunxit amicicia,en hví skal okkr saman tengja sǫnn vinátta
382,435,Sed nimis hoc cela soli sibi posco reuela,Sed nimis hoc cela soli sibi posco reuela,Sed nimis hoc cela soli sibi posco reuela,Sed nimis hoc cela soli sibi posco reuela,en því skalt þú þó mjǫk leyna ok svá honum einum segja
383,436,Non tamen incipias hac racione loqui,Non tamen incipies hac racione loqui,Non tamen incipias hac racione loqui,Non tamen incipias hac racione loqui,
384,437,Illum sepe prius multo uolumine tempta,Illum sepe prius multo temptamine tempta,Illum sepe prius multo molimine tempta,Illum sepe prius multo temptamine tempta,en hans skalt þú þó fyrst með mikilli freistni freista
385,438,Quod dixi dicet forsitan ipse tibi,Quod dixi dicet forsitan ipse tibi,Quod dixi dicet forsitan tibi ille,Quod dixi dicet forsitan ille tibi,en er ek sagða þá mun hann með atburð þér segja
386,439,Hinc modo discede fac et precor omnia caute,Hinc modo discede fac et precor omnia caute,Hinc modo discede fac - precor omnia caute,Hinc modo discede fac ut precor omnia caute,en þú far nú brott með bǿn minni ok ger allt með lǽvísi
387,44,Decrescitque color uisque decorque meus,Decrescitque decor usque colorque meus,Decrescitque color uisque decorque meus,Decrescitque color uisque decorque meus,ok litr þverr ok afl minnkar ok mín fegrð
388,440,Et tibi que dicet cras michi cuncta refert,Et tibi que dicit cras michi cuncta refer,Et tibi que dicet cras michi cuncta refer,Et tibi que dicet cras michi cuncta refer,ok allt þat sem hann rǿðir fyrir þér þá seg mér á morgin
389,441,Multociens animos frustratur spesque laborque,Multociens hominis frustratur spesque laborque,Multociens homines frustratur spesque laborque,Multociens hominum frustratur spesque laborque,
390,442,Non res ut uolumus Pamphile nostra uenit,Non res ut uolumus Pamphile nostra uenit,Non res ut uolumus Pamphile nostra uenit,Non res ut uolumus Pamphile nostra uenit,Ást þín ok starf mitt Pamphile er ei komit sem ek vilda
391,443,Tardius ad nostrum nimis aduocor ipsa iuuamen,Tardior ad uestrum nimis aduocor ipsa iuuamen,Tardius ad uestrum nimis aduocor ipsa iuuamen,Tardius ad uestrum nimis aduocor ipsa iuuamen,ek var kǫlluð of síðla þér til liðs
392,444,Nam prodesse nequit arsque laborque tibi,Nam prodesse nequit arsque laborque tibi,Tunc prodesse - arsque laborque meus,Nam prodesse nequit arsque laborque tibi,"því at hvárki mun nú stoða
 þér starf né vél"
393,445,Res ut testatur Galthee teda paratur,Res ut testatur Galthee teda paratur,Res ut credatur Galthee teda paratur,Res ut testatur Galthee teda paratur,"Galatheae er nú giftarorð
 búit svá sem ǫll þjóð segir"
394,446,- Miror enim cultus quos parat illa domus,- Miror enim cultus quos parat illa domus,Hos Miror enim cultus quos parat illa domus,- Miror enim cultus quos parat illa domus,ok undra þann umbúnað er henni er búinn
395,447,Sunt centum cause quibus illud suspicor esse,Sunt centum cause quibus istud suspicor esse,Sunt centum cause quibus illud suspicor essem,Sunt centum cause quibus istud suspicor esse,"víst hundrað hluta
 standa í móti því er ek vǽnta"
396,448,Sed suus ipsa tamen celat uterque parens,Sed tamen ista nimis celat uterque parens,Sed suus ista tamen celat uterque parens,Sed suus ista tamen celat uterque parens,"en þó leyna
 þau faðir ok móðir"
397,449,Hoc tibi quod dico sapiencius accipe posco,Hoc tibi quod dico sapiencius accipe posco,Hoc tibi quod dico sapiencius accipe posco,Hoc tibi quod dico sapiencius accipe posco,ok þess bið ek þik at þú berr þetta vitrliga er ek segi þér
398,45,Hec nulli dixi nec que michi uulnera fecit,Hec nulli dixi nec que michi uulnera fecit,Hoc nulli dixi nec que mea uulnera fecit,Hoc nulli dixi nec que michi uulnera fecit,ok þetta sagða ek engum ok ei nefnda ek þann er mik sǽrði
399,450,Mitte quod esse nequit quere quod esse potest,Mitte quod esse nequit quere quod esse potest,Mitte quod esse nequit quere quod esse potest,Mitte quod esse nequit quere quod esse potest,ok lát laust þat er ekki má vera ok leita þess er vera má
400,451,Heu michi nam fugiunt uires et corporis usus,Heu michi quo fugiunt uires et corporis usus,Heu michi quo fugiunt uires et corporis usus,Heu michi quo fugiunt uires et corporis usus,"Uæis sé mér hvar er afl mitt komit ok huggan
 lífs míns"
401,452,Mens mea non seruit nec mea lingua michi,Mens mea non seruit nec mea lingua michi,Mens mea non seruit nec mea lingua michi,Mens mea non seruit nec mea lingua michi,
402,453,Heu miser in nostris est nulla potencia membris,Heu miser in nostris est nulla potencia membris,Heu miser in nostris est nulla potencia membris,Heu miser in nostris est nulla potencia membris,væiss er mér veslum ekki er megin í limum mínum
403,454,Quorum quodque suum denegat officium,Horum quodque suum denegat officium,Horum queque suum denegant officium,Horum quoque suum denegat officium,hverr limr níttar sinni þjónastu
404,455,Spes mea me lesit per spem Venus ossibus hesit,Spes mea me lesit per spem Venus ossibus hesit,Spes mea me lesit per spem Venus ossibus hesit,Spes mea me lesit per spem Venus ossibus hesit,ván hefir mik blekkðan ván hefir mik með angri ok ergi fluttan
405,456,Spes procul abscessit nec tamen ignis abest,Spes procul abscessit nec tamen ignis abest,Spes procul abscessit nec tamen ignis abest,Spes procul abscessit nec tamen ignis abest,nú er ván langt í brott farin ok brennandi ást í stað komin
406,457,Nulla parte suos mea cernit carbasa portus,Nulla parte suos mea cernit carbasa portus,Nulla parte suos cernunt uiam carbasa portus,Nulla parte suos cernunt mea carbasa portus,Nú má várt segl enga hǫfn sjá
407,458,Nec sentire potest anchora nostra solum,Nec sentire potest anchora nostra solum,Nec sentire potest anchora nostra solum,Nec sentire potest anchora nostra solum,ok várt akkeri má hvergi land kenna
408,459,Lesit nostra suam quo querat cura salutem,Nescit nostra suam qua querat cura salutem,Nescit nostra suam quo querat cura salutem,Nescit nostra suam qua querat cura salutem,ok várr harmr veit sér hvergi hjalpar ván
409,46,Iustaque causa fuit dicere que uetuit,Iustaque causa fuit dicere que uetuit,Iustaque causa fuit dicere qoud uetuit,Iustaque causa fuit dicere que uetuit,Ok rétt var sǫk ok sǫgn
410,460,Fert Galathea mei sola doloris opem,Fert Galathea meam sola doloris salutis,Fert Galathea mei sola doloris opem,Fert Galathea mei sola doloris opem,einsaman Galathea hefir huggan mína ok harms míns
411,461,Causa mee mortis hec est et cura salutis,Causa mee mortis hec est et causa salutis,Causa mee mortis hec est et causa salutis,Causa mee mortis hec est et causa salutis,ok hon er sǫk bana míns ok hon er ván heilsu minnar
412,462,Qua si non paciar tunc placet ut moria,Qua si non pociar tunc placet ut moria,Qua si non pociar tunc placet ut moria,Qua si non pociar tunc placet ut moria,"því ef ek má eigi hennar njóta
 þá líkar mér at deyja"
413,463,Stulte quid insanis cur te dolor urget inanis,Stulte quid insanis quid te dolor urget inanis,Stulte quid insanis cur te dolor urget inanis,Stulte quid insanis cur te dolor urget inanis,Heyr þú fól hví ǿrðistu hverr ósløkkiligr harmr þrøngvir þér
414,464,Acquirit gemitus premia nulla tuus,Acquirit gemitus premia nulla tuus,Acquirit gemitus munera nulla tuus,Acquirit gemitus premia nulla tuus,"þín aumkan aflar þér enga ambun
"
415,465,Temperet ergo tuum modus et prudencia fletum,Temperet ergo tuum modus et prudencia fletum,Temperet ergo tuum modus et prudencia fletum,Temperet ergo tuum modus et prudencia fletum,þú skalt stilla harmi þínum vél
416,466,Terge tuas lacrimas prospice quid facias,Terge tuas lacrimas prospice quid facias,Terge tuas lacrimas prospice quid facias,Terge tuas lacrimas prospice quid facias,ok lǽvísi ok hygg at hvat þú skalt gera
417,467,Conspicit ingentes animos inanis egestas,Concipit ingentes animos inanis egestas,Concipit ingentes animos mortalis egestas,Concipit ingentes animos inanis egestas,mikil fátǿkð gerir manni við margt at leita
418,468,Et facit artificiem sepius hec homniem,Et facit artificiem sepius hec homniem,Et facit artificiem sepius hoc homniem,Et facit artificiem sepius hec homniem,
419,469,Ars hominis magnum superat studiosa periclum,Ars hominum magnum superat studiosa periclum,Ars hominis magnum superat studiosa periclum,Ars hominis magnum superat studiosa periclum,íðn ok vél manns sigrar mikinn háska
420,47,Dicitur et fateor me nobilioribus ortam,Dicitur et fateor me nobilioribus orta,Dicitur et fateor me nobilioribus orta,Dicitur et fateor me nobilioribus ortam,ok þat er satt ok ek játa at hon er kyngǫfgari mér
421,470,"Me labor arsque uigil forte iuuaret adhuc""","Te labor arsque uigil forte iuuaret adhuc""","Te labor arsque uigil forte iuuaret adhuc""","Te labor arsque uigil forte iuuabit adhuc""",enn mǽtti með atburð starf okkart með vild endask ok með hjǫlp koma
422,471,Quis labor heu tantum posset superare periclum,Quis labor heu tantum posset superare periclum,Quis heu labor tantum posset superare periclum,Quis labor heu tantum posset superare periclum,Ho kvað hann hvert starf myndi sigra mega svá mikinn háska
423,472,Spes mea tanta perit imminet hora leti,Spes mea tota perit imminet hora thori,Spes mea tota perit imminet hora thori,Spes mea tota perit imminet hora thori,ván mín er ǫll fyrir farin því at nú er komit giftarkveld
424,473,Nec uiuente suo michi nuberet ipsa marito,Nec uiuente suo michi nuberet illa marito,Nec uiuente suo michi nuberet illa marito,Nec uiuente suo michi nuberet illa marito,eigi mun hon mér giftask meðan búandi hennar lifir
425,474,Crimen legitimos est uiolare thoros,Crimen legitimos est uiolare thoros,Crimen legitimos est uiolare thoros,Crimen legitimos est uiolare thoros,synð er mikil hvílu at saurga mundi keypta
426,475,Ad nichilum prorsus meus est labor iste redactus,Ad nichilum prorsus labor est meus iste redactus,Ad nichilum prorsus meus est labor iste redactus,Ad nichilum prorsus meus est labor inde redactus,"þetta mitt starf er ǫllungis
 at engu orðit"
427,476,Et mea cura sue perdidit artis opem,Et mea cura sue perdidit artis opem,Et mea cura sue perdidit artis opem,Et mea cura sue perdidit artis opem,ok mín kunnasta hefir hjalp tapat sinna véla
428,477,Nulla dies mitem dabit et nox nulla quietem,Nulla dies mitem dabit et nox nulla quietem,Nulla dies mitem dabit et nox ulla quietem,Nulla dies mentem dabit et nox nulla quietem,dagr né nátt man sá engi koma er mér hǿgja hvíld gefi
429,478,Semper me miserum uexat inanis amor,Semper me miserum carpit inanis amor,Semper me miserum carpit inanis amor,Semper me miserum carpet inanis amor,fá nytsemð mun ǽ með mér veslum liggja
430,479,Sepius exigua color - labitur hora,Sepius exigua labor ingens labitur hora,Sepius exigua dolor ingens labitur hora,Sepius exigua dolor ingens labitur hora,Oft fellr mikill harmr á lítilli stundu
431,48,Hijs ideo metuo dicere uelle meum,Huic ideo metuo dicere uelle meum,Hijs ideo metuo dicere uelle meum,Hijs igitur metuo dicere uelle meum,
432,480,Ingens in paruis umbrabus aura cadit,Ingens ex paruis ymbribus aura cadit,Ingens et paruis ymbribus aura cadit,Ingens ex paruis ymbribus aura cadit,ok mikit veðr fellr með litlu regni
433,481,Estque serena dies post longo gracior ymbres,Estque serena dies post longos gracior ymbres,Estque serena dies post longos gracior ymbres,Estque serena dies post longos gracior ymbres,ok bjartr dagr er miklu at þekkri at hann komi eftir mikit myrkr
434,482,Et post triste malum fit ipsa salus,Et post triste malum gracior ipsa salus,Et post triste malum gracior ipsa salus,Et post triste malum dulcior ipsa salus,ok sjǫlf heilsa er þekkri eftir langa sótt
435,483,Tu modo respira dolor absit fectus et ira,Tu modo respira dolor absit fletus et ira,Tu modo respira dolor absit fletus et ira,Tu modo respira dolor absit fletus et ira,Andvarpar þú nú ok harmr langt í brott fari
436,484,Sunt prope magna tue gaudia tristicie,Sunt prope magna tue gaudia tristicie,Sunt prope magna tue gaudia tristicie,Sunt prope magna tue gaudia tristicie,því at í nánd er stórligr fagnaðr þínum hryggleik
437,485,Nostrum uelle tua nobis faciet Galathea,Nostrum uelle tua nobis faciet Galathea,Nostrum uelle tua nobis faciet Galathea,Nostrum uelle tua nobis faciat Galathea,Galathea þín man gera okkarn vilja
438,486,"Omnino nostris se dedit imperij""","Omnino nostris se dabit imperij""","Omnino nostris se dedit imperij""","Omnino nostris se dedit imperij""",hon hefir gefit sik með ǫllu undir várt vald
439,487,Vt pia promissis matrum solercia uanis,Vt pia promissis matrum solercia uanis,Vt pia promissis matrum solercia uanis,Vt pia promissis matrum solercia uanis,
440,488,plorantes pueros admonet ut taceant,plorantes pueros admouet ut taceant,plorantes pueros admonet ut taceant,plorantes pueros admonet ut taceant,
441,489,Hic me fortassis falso solamine pascis,Sic me fortassis falso solamine pascis,Sic me fortassis falso solamine pascis,Sic me fortassis falso solamine pascis,svá at sǫmu fǿðir þú mik með flǽrðsamligum hugganum
442,49,Fertur et est uerum quod me sit dicior illa,Fertur et est uerum quod me sit dicior illa,Fertur et est uerum quod me sit dicior illa,Fertur et est uerum quod me sit dicior illa,
443,490,Vt dolor a tristi pectore tristis eat,Vt dolor a tristi pectore tristis eat,Vt dolor a tristi pectore tristis eat,Vt dolor a tristi pectore tristis eat,at hryggleikr ok harmr brott fari
444,5,Vnde futura meis maiora pericula dampnis,Vnde futura meis maiora pericula dampnis,Vnde futura meis maiora pericula dampnis,Vnde futura meis maiora pericula dampnis,
445,50,Et decus et dotes copia sepe rogat,Et decus et dotes copia sepe rogant,Et decus et dotes copia sepe rogat,Et decus et dotes copia sepe rogat,En þat biðr þó hennar
446,51,Nec michi sunt dotes decus ingens et copia grandis,Nec michi sunt dotes decus ingens - copia grandis,Non michi sunt dotes decus ingens - copia grandis,Nec michi sunt dotes decus ingens - copia grandis,Sǿmð ok tilgjǫf er eigi til með mér né gnótt fjár
447,52,sed quod habere queo quero labore meo,sed quod habere queo quero labore meo,sed quod habere queo quero labore meo,sed quod habere queo quero labore meo,"eigi er annat með mér en ek afla með erfiði mínu
"
448,53,Cum modo sit diues cuiusdam nata bubulci,Dummodo - sic diues cuiusdam nata bubulci,Dummodo - sit diues cuiusdam nata bubulci,Dummodo - sit diues cuiusdam nata bubulci,Nú ef sǽl er orðin ein nautrekadóttir
449,54,Eligit e mille quemlibet illa uirum,Eligit e mille quemlibet illa uirum,Eligit e mille quemlibet illa uirum,Eligit e mille quemlibet illa uirum,kyss þann er líkar ór þúshundrað biðla
450,55,Illius in forma nostros tremor occupat artus,Illius in forma nostros tremor occupat artus,Illius in forma nostros tremor occupat artus,Illius in forma nostros tremor occupat artus,"Ok af frǽgð fegrð hennar
 titrar mitt hvert bein"
451,56,Et magis hoc uotum dicere causa uetat,Et magis hoc uotum dicere causa uetat,Et magis hec uotum dicere causa uetat,Et magis hoc uotum dicere causa uetat,ok sǫk meinaði mér at segja þetta
452,57,Concipit ingentes animos fiducia forme,Concipit ingentes animos fiducia forme,Concipit ingentes animos fiducia forme,Concipit ingentes animos fiducia forme,"Traust frǽgðar getr oft hughreysti mikla
"
453,58,Inque modum dominam non sinit esse suam,Inque modum dominam non sinit esse suam,Inque modum dominam non sinit esse suam,Inque modum dominam non sinit esse suam,ok eigi lǽtr í hǽtti sína dróttning
454,59,Has de corde meo temptaui demere curas,Has de corde meo temptaui demere curas,Has de corde meo temptaui demere curas,Has de corde meo temptaui demere curas,Ok freistaða ek ok at hrinda mínu hjarta þessa rǿkð
455,6,spero salutis opem nec medicina dabit,spero salutis opem nec medicina dabit,spero salutis opem nec medicina dabit,spero salutis opem nec medicina dabit,
456,60,Sepius obstanti tunc magis arsit amor,Sepius obstanti tunc magis auxit amor,Sepius obstanti tunc magis arsit amor,Sepius obstanti tunc magis arsit amor,en því heitari brennr ást í mér
457,61,En mala nostra uides en nostra pericula nosti,En mala nostra uides en nostra pericula nosti,En mala nostra uides en nostra pericula nosti,En mala nostra uides en nostra pericula nosti,"nú mátt þú sjá hversu illt ek þoli því at þér er kunnr háski
 várr"
458,62,Inde preco precihus mitis adesto meis,Vnde preco precihus mitis adesto meis,Vnde preco precihus mitis adesto meis,Vnde preco precihus mitis adesto meis,Því bið ek þik ver þú hógvǽr bǿnum mínum
459,63,Non michi respondes non dictis porrigis aures,Non michi respondes nec dictis porrigis aures,Non michi respondes non dictis porrigis aures,Non michi respondes nec dictis porrigis aurem,ok eigi þú í móti mér mǽl
460,64,Nec tua clara meum lumina lumen habent,Nec tua clara meum lumina lumen habent,Nec tua clara meum lumina lumen habent,Nec tua clara meum lumina lumen habent,ok þín hin fǫgru augu hafi mína sýn
461,65,Aut tu tolle tuas nostro de corde sagittas,Aut tu tolle tuas nostro de corde sagittas,Aut tu tolle tuas de corde nostro sagittas,Aut tu tolle tuas nostro de corde sagittas,"Annathvárt tak þú ǫrvar þínar
 ór hjarta mínu"
462,66,Aut tu seua tuis uulnera pasce modi,Aut tu seua tuis uulnera pasce modi,Aut tu seua tuis uulnera pasce modi,Aut tu sana tuis uulnera pasce modi,eða fǿr þú grimmt sár með þínum háttum
463,67,Quis posset tanti curam tolerare laboris,Quis posset curas tanti tolerare laboris,Quis posset tanti curam tolerare laboris,Quis posset tanti curam tolerare laboris,Hverr mátti rǿkð þola svá mikils starfs
464,68,Que domino flent premia nulla daret,Que domino flenti premia nulla daret,Que domino flenti premia nulla daret,Que domino flenti premia nulla daret,er engi laun gǽfi grátandi dróttni
465,69,Insto precando tibi michi nam dolor anxius instat,Insto precando - michi nam dolor anxius instat,Isto rogando tibi michi nam dolor anxius instat,Insto precando tibi michi nam dolor anxius instat,rétt biðjandi til þín því at angrsamt starf þrøngvir mér
466,7,Quam prius ipse uiam meliorem capere possim,Quam prius ipse uiam meliorem carpere possim,Quam prius ipse uiam meliorem carpere possum,Quam prius ipse uiam meliorem carpere possum,"Hverja gatu
 skal ek bezta grípa"
467,70,Assiduasque preces concipit ipse dolor,Assiduasque preces concipit inde dolor,Assiduasque preces concipit ille dolor,Assiduasque preces concipit ipse dolor,Ok sjalfr getr oft sǫmu bǿnar
468,71,Tunc Venus hoc inquit Labor improbus omnia uincit,Tunc Venus hec inquit Labor improbus omnia uincit,Tunc Venus hec inquit Labor improbus omnia uincit,Tunc Venus hoc inquit Labor improbus omnia uincit,Hǿfiligt starf sigrar alla hluti
469,72,Qualibet et poteris ipse labore frui,Quolibet et poteris ipse labore frui,Qualibet et poteris ipse labore frui,Qualibet et poteris ipse labore frui,ok þú skalt hafa hverja er þér líkar ef þú vilt starf á leggja
470,73,Et monstrare tuos animos nulli uerearis,Et monstrare tuos animos nulli uerearis,Et monstrare tuos animos nulli uerearis,Et monstrare tuos animos nulli uerearis,Ok fyrir engarri skalt þú hrǽðask þitt skap at sýna
471,74,Vix erit in mille que neget una tibi,Vix erit e mille que neget una tibi,Vis erit e mille que neget una tibi,Vix erit e mille que neget una tibi,Trautt man finnask ein í þúshundraði sú er þér mun níttask
472,75,Quodque precando petes prius aspera forte negabit,Quamque precando petes prius aspera forte negabit,Quamque precando potes prius aspera forte negabit,Quam precando petes prius aspera forte negabit,Ok þess er þú munt biðjandi leita ok með atburð þá mun hon fyrst snarliga nítta
473,76,Sed leue pondus habet illius asperitas,Sed leue pondus habet ipsius asperitas,Sed leue pondus habet illius asperitas,Sed leue pondus habet illius asperitas,"En snarleikr
 hennar hefir létta byrði"
474,77,Iam iurando prius quos uenditor ipse negabat,Nam iurando prius quos uenditor ipse negabat,Nam iurando prius quos uenditor ipse negabat,Nam iurando prius quos uenditor ille negabat,
475,78,Venales census improbus emptor habet,Venales census improbus emptor habet,Venales census improbus emptor habet,Venales census improbus emptor habet,
476,79,Nec mare transisset pauidus si nauta fuisset,Nec mare transisset pauidus si nauta fuisset,Non mare transisset pauidus si nauta fuisset,Nec mare transisset pauidus si nauta fuisset,
477,8,Heu michi quid facia Non bene certus eo,Heu michi quid facia Non bene tuts eo,Heu michi quid facia Non bene certus eo,Heu michi quid facia Non bene tuts eo,"eða hvat skal ek til taka
 Hvergi má ek øruggr fara"
478,80,Turgida cum primum restitit unda rati,Turgida cum primum restitit unda rati,Turgida cum primum restituit unda rati,Turgida cum primum restitit unda rati,
479,81,Ergo tuis primum si non fauet ipsa loquelis,Ergo tuis primum si non fauet ipsa loquelis,Ergo tuis primum si non datur illa loquelis,Ergo tuis primum si non fauet ipsa loquelis,Nú fyrir því er hon játar eigi fyrst þinni rǿðu
