,Verse,B1,P3,To,W1,Normalized
240,31,Dixi non magna misero michi magna uidentur,Dixi non magna misero michi magna uidentur,Dixi non magna michi misero magna uidentur,Dixi non magna misero michi magna uidentur,kveð þú ok eigi stóra vera en þó sýnask mér stórir vera
241,310,Et facit illa meis omnia consilijs,Et facit illa meis omnia consilijs,Et facit ipsa meis omnia consilijs,Et facit illa meis omnia consilijs,
242,311,Non loquar ipsa diu tibi me premit altera cura,Non loquor ipsa diu tibi me premit altera cura,Non loquar ipsa diu tibi me premit altera cura,Non loquar ipsa diu tibi me premit altera cura,ok hon lǽtr mjǫk at mínu ráði
243,312,Carpat quisque uias et sibi querat opem,Carpat quisque uias et sibi querat opem,Carpat quisque uias et sibi querat opem,Carpit quisque uias et sibi querit opem,en eigi mun ek nú fleira rǿða
244,312,Carpat quisque uias et sibi querat opem,Carpat quisque uias et sibi querat opem,Carpat quisque uias et sibi querat opem,Carpit quisque uias et sibi querit opem,fari hverr þar er ráð þykkir
245,313,Hoc michi parant opus nec me premit altera cura,Hac michi prestat opem nec me premit altera cura,Hoc michi prestat - nec - premit altera cura,Hoc michi prestat opus nec - premit altera cura,Enn er mér ekki hǿgra ok ei þrøngvir mér annat starf
246,314,Hanc michi si dederis omnia prestiteris,Hanc michi si dederis omnia prestiteris,Hanc michi si dederis omnia prestiteris,Hanc michi si dederis omnia prestiteris,ef þú þetta veitir mér þá er sem þú gefir mér hvatvetna
247,315,Convenit externos mercari sepe labores,Convenit hesternos mercari sepe labores,Convenit externos mercari sepe labores,Convenit externos mercari sepe labores,oft hǿfir með fé at kaupa annars starf
248,316,Emptus et ut capiat premia digna labor,Emptus et ut capiat premia digna labor,Tempus et ut capiat premia digna labor,Emptus et ut capiat premia digna labor,"ok at keypt erfiði
 hafi verðuga laun"
249,317,Nulla parte tuum frustrabor crede laborem,Nulla parte tuum frustrabor crede laborem,Nulla parte tuum frustrabor crede laborem,Nulla parte tuum frustrabor crede laborem,trú þú mér starf þitt skal ek þér launa
250,318,Nunc quibus indigeo si michi provideas,Nunc quibus indigeo si michi provideas,Nunc quibus indigeo si michi provideas,Nunc quibus indigeo si michi provideas,ef þú vilt sjá fyrir mér um þat sem ek þarf
251,319,Deprecor hec unu mercedis dic michi nomen,Deprecor hoc unu mercedis dic michi nomen,Deprecor hoc unu mercedis dic michi nomen,Deprecor hoc unu mercedis dic michi nomen,þat eina bið ek þik seg mér hvat þú vill þiggja
252,32,Sed tamen ista dare non tibi difficile est,Sed tamen ista dare non tibi difficile est,Sed tamen ista dare non tibi difficile est,Sed tamen ista dare non tibi difficile est,En þér er þó mér þetta at gefa ei alltorveldligt
253,320,"Et quodcunque - dixeris protinus ipse dabo""","Et quodcunque michi dixeris - ipse dabo""","Et quecunque michi dixeris - ipse dabo""","Et quodcunque michi dixeris - ipse dabo""",
254,321,"""Plura uolunt et plura petunt quibus instat egestas","""Plura uolunt et plura petunt quibus instat egestas","""Plura uolunt et plura petunt quibus instat egestas","""Plura uolunt et plura petunt quibus instat egestas",Margt vilja ok fleira beiðask þeir er margs þurfu
255,322,Quantis indigeam tanta referre pudet,Quantis indigeo tanta referre pudet,Quantis indigeo tanta referre pudet,Quantis indigeo tanta referre pudet,"svá margs sem ek þarf þá skǫmmumsk
 ek at segja"
256,323,Diuicias multas habui dum floruit etas,Diuicias habui multas dum floruit etas,Diuicias multas habui dum floruit etas,Diuicias multas habui dum floruit etas,ek átta fé mikit þá er ek var ung
257,324,Copia discessit pluribus indigeo,Copia discessit pluribus indigeo,Copia discessit pluribus indigeo,Copia discessit pluribus indigeo,en nú er gnótt fjár brott farin ok þurft í stað komin
258,325,Me nam debilitas nimium spoliauit et etas,Me mea debilitas nimis exspoliauit et etas,Me debilitas et etas,Me mea debilitas nimis exspoliauit et etas,ok vanheilsa ok aldr hafa mik eydda
259,326,Commoda nulla facit arsque laborque meus,Commoda nulla facit arsque laborque michi,Commoda nulla facit arsque laborque meus,Commoda nulla facit arsque laborque meus,en vél mín ok starf kømr ekki at haldi
260,327,Si modo nostra tibi prodesse iuuamina sentis,Si modo nostra tibi prodesse iuuamina sentis,Si modo nostra tibi prodesse iuuamina sentis,Si modo nostra tibi prodesse iuuamina sentis,nú ef þú veizt orð mín duga
261,328,"Deprecor ut pateat hinc michi uestra domus""","Deprecor ut pateat hinc michi uestra domus""","Deprecor ut pateat hinc michi uestra domus""","Deprecor ut pateat hinc michi uestra domus""",þá bið ek þik at hús þitt sé opit fyrir mér heðan í frá
262,329,Hinc tibi nostra domus et cetera cuncta patebunt,Hinc tibi nostra domus et cetera cuncta patebunt,Hinc tibi nostra domus et cetera nostra patebunt,Hinc tibi nostra domus et cetera nostra patebunt,Heðan í frá skal hús mitt þér opit vera ok allt várt þér í boði
263,33,'Annuo' dic tantu Iam iamque beatus habebor,'Annue' dic tantu Iam iamque beatus habebor,'Annuo' dic tantu Iam iamque beatus habebor,'Annuo' dic tantu Iam iamque beatus habebor,"Seg at eins at ek játa ok þegar
 mun ek sǽll vera"
264,330,Sitque sub imperio copia nostra tuo,Sitque sub imperio copia nostra tuo,Sitque sub imperio copia nostra tuo,Sitque sub imperio copia nostra tuo,ok ǫll mín eign undir þínu valdi
265,331,Vultum grata michi concordia nos modo iunxit,Multum grata michi modo nos concordia iunxit,Multum grata michi modo nos concordia iunxit,Multum grata michi modo nos concordia iunxit,með ǫllu hefir nú vinátta okkr samtengt ok okkr saman bundit
266,332,Iactaque sollicitet inter uterque fides,Pactaque sollicitet inter utrumque fides,Pactaque sollicitet inter utrumque fides,Pactaque sollicitet inter utrumque fides,
267,333,Hinc precor ut uigil sollercia uestra laborque,Hinc precor ut uigilet sollercia uestra laborque,Hinc precor ut uigilet sollercia uestra laborque,Hinc precor ut uigilet sollercia uestra laborque,"Ok þess bið ek þik at vél þín ok starf vekisk heðan
 í frá"
268,334,Nec racionem - - sua rem bene prouideat,Et racione - - suam rem bene prouideat,Et racione - - suam rem bene prouideat,Et racione meam uel suam rem bene prouideat,ok at vél þín sé mér til hugganar með þinni skynsemi
269,335,Principium finemque simul prudencia spectat,Principium finemque simul prudencia spectet,Principium finemque simul prudencia spectat,Principium finemque simul prudencia spectat,lǽvísi hlýtr bǽði upphaf ok enda
270,336,Porro finis habet crimen et omne decus,Rerum finis habet crimen et omne scelus,Rerum finis habet crimen et omne decus,Rerum finis habet crimen et omne decus,ok þó hefir endalykð allra hluta lǫst ok allra sǿmð
271,337,Verbi principium finem quoque conspice uerbi,Verbi principium uerbi quoque conspice finem,Verbi principium finem quoque conspice uerbum,Principium verbi finem quoque conspice uerbi,lít á upphaf máls ok endalykð
272,338,"Vt melius possia premeditata loqui""","Vt melius possia premeditata loqui""","Vt melius possia premeditata loqui""","Vt melius possia premeditata loqui""",at þú megir þá betr rǿða fyrirǽtlat mál
273,339,"""Hac manet in uilla nimium formosa iuuentus","""Hac manet in uilla nimium formosa iuuentus","""Hac manet in uilla nimium formosa iuuentus","""Hac manet in uilla nimium formosa iuuentus",Hér er í þeima bǿ eitt ungmenni allfagrt
274,34,Et sic euenient prospera cuncta michi,Et sic euenient prospera cuncta michi,Et sic euenient prospera cuncta michi,Et sic peruenient prospera cuncta michi,"Ok þá þegar munu mér koma
 allir hógvǽrir hlutir"
275,340,Crescit et in cunctis moribus ipsa bonis,Crescit et in cunctis moribus ipsa bonis,Crescit et in cunctis moribus ipsa bonis,Crescit et in cunctis moribus illa bonis,ok þat vex í ǫllum sǿmiligum siðum
276,341,Non fuit in nostro melior nec dulcior euo,Non fuit in nostro melior nec dulcior euo,Nec fuit in nostro melior nec dulcior euo,Non fuit in nostro melior nec dulcior euo,ok engi var betri né kurteisari
277,342,Suscipit ipse meam tam bene pauperiem,Suscipit ipse meam tam bene pauperiem,Suscipit ipsa meam tam bene pauperiem,Suscipit illa meam tam bene pauperiem,um vára daga
278,342,Suscipit ipse meam tam bene pauperiem,Suscipit ipse meam tam bene pauperiem,Suscipit ipsa meam tam bene pauperiem,Suscipit illa meam tam bene pauperiem,ok hann tók vel við várri fátǿkð
279,343,Precellit cunctos omni bonitate coeuos,Precellit cunctos omni bonitate coeuos,Precellit cunctos omni bonitate coeuos,Precellit cunctos omni bonitate coeuos,ok hann yfirstígr alla með lofi sínu jafnaldra sína
280,344,Pamphilus et socios laudibus exsuperat,Pamphilus et socios laudibus exsuperat,Pamphilus et socios laudibus exsuperat,Pamphilus et socios laudibus exsuperat,Pamphilus yfirkømr alla sína félaga
281,345,Est stultos stultus et miti mitis ut agnus,Est stulto stultus et miti mitis ut agnus,Est stultus stulto et miti mitis ut agnus,Est stulto stultus est miti mitis ut agnus,"hann er heimskr heimskum
"
282,345,Est stultos stultus et miti mitis ut agnus,Est stulto stultus et miti mitis ut agnus,Est stultus stulto et miti mitis ut agnus,Est stulto stultus est miti mitis ut agnus,ok hǿgvǽrr hógvǽrum sem lamb
283,346,Stulticie sapiens iure resistit homo,Stulticie sapiens iure resistit homo,Stulticie sapiens iure resistit homo,Stulticie sapiens iure resistit homo,vitr maðr stendr í móti heimskum með réttu
284,347,manet hanc tante probitatis pubes in urbe,manet hac tante pubes probitatis in urbe,manet hac tante pubes probitatis in urbe,manet hac tante probitatis pubes in urbe,"engi ǿskumaðr
 er jafnvel reyndr í borg þessi"
285,348,Quas acquirit opes non uorat ingluuies,Quas acquirit opes non uorat ingluuies,Quas acquirit opes non uorat ingluuies,Quas acquirit opes non uorat ingluuies,"hans afl eyðir
 ei ofdrykkja"
286,349,Est nimis ille probus bona fuit eius nam origo,Est nimis ille probus bona nam fuit eius origo,Est nimis ille probus bona nam fuit eius origo,Est nimis ille probus bona nam fuit eius origo,hann er vel siðaðr því at góðr var uppruni hans
287,35,Est michi uicina uellem non esset puella,Est michi uicina uellem non esse puella,Est michi uicina uellem non esset puella,Est michi uicina uellem non esse puella,Ein er sú í grennd við mik er ek vilda eigi at mǽr vǽri
288,350,Arbore de dulci dulcia poma cadunt,Arbore de dulci dulcia poma cadunt,Arbore de dulci dulcia poma cadunt,Arbore de dulci dulcia poma cadunt,sǿtt epli fellr af sǿtu tré
289,351,Premonstrat signis prolem natamque frequenter,Premonstrat signis prolem natura frequenter,Premonstrat signis prolem natura frequenter,Premonstrat signis prolem natura frequenter,kynfylgja birtir oft hvaðan kominn er
290,352,Sepe solet similis filius esse patri,Sepe solet similis filius esse patri,Sepe solet filius similis esse patri,Sepe solet similis filius esse patri,oft líkisk sonr feðr
291,353,En iuxta portam stantem uideo Galatheam,En iuxta portam uideo stantem Galatheam,Et iuxta portam uideo stare Galatheam,En iuxta portam uideo stantem Galatheam,"ek sé Galatheam standa hjá garðshliði
"
292,354,Queque locuta fui forsitan audierit,Queque locuta fui forsitan audierat,Queque locuta fui forsitan audierit,Queque locuta fui forsitan audierit,kann vera með atburð at hon hafi heyrt mína rǿðu
293,355,Nec non esse modo quemquam Galathea putabam,Hic non esse modo quemquam Galathea putaui,Hic non essem modo quemquam Galathea putabam,Hic non esse modo quemquam Galathea putabam,vit þat Galathea at ek hugða engan í nánd vera
294,356,Sed tamen ipsa nimis uera locuta fui,Sed tamen ipsa nimis uera locuta fui,Sed tamen ipsa nimis uera locuta fui,Sed tamen ipsa nimis uera locuta fui,en þó hefi ek ekki logit
295,357,Pamphilus hanc certe pre cuntis pollet in urbe,Pamphilus hac certe pre cuntis pollet in urbe,Pamphilus hac certe pre cuntis pollet in urbe,Pamphilus hac certe pre cuntis pollet in urbe,Pamphilus birtisk víst yfir ǫllum mǫnnum í borg þessi
296,358,Egregie uitam proudet ipse suam,Egregie uitam proudet ipse suam,Egregie uitam proudet ipse suam,Egregie uitam proudet ille suam,menn veit fagrliga varðveitir hann sína atferð
297,359,Illi semper honor et laus et gloria crescit,Illi semper honor et laus et gloria crescit,Illi semper honor et laus et gloria crescit,Illi semper honor et laus et gloria crescit,sína sǿmð ok dýrð ok lof vex með honum jafnan
298,36,Si non subueniat gracia uestra michi,Si non subueniat gracia uestra michi,Si non subueniat gracia uestra michi,Si non subueniat gracia uestra michi,Ok ef eigi stoðar mér miskunn yður
299,360,Et merito nullus inuidet ipse sibi,Et merito nullus inuidet inde sibi,Et merito nullus inuidet inde sibi,Et merito nullus inuidet inde sibi,ok með réttu má hann engi ǫfunda
300,361,Et nimium locuples sed non tamen inde superbit,Est nimium locuples sed non tamen inde superbit,Est nimium locuples sed non tamen inde superbit,Est nimium diues sed non tamen inde superbit,hann er vel maðr ok mikillǽtisk hann þó ekki af því
301,362,Illius et nullum copia crimen habet,Illius et nullum copia crimen habet,Illius et nullum copia crimen habet,Illius et nullum copia crimen habet,ok hans auðr hefir engan lǫst
302,363,Esset ut ille tuus et mitti Galathea maritus,Esset ut ille tuus uellem - Galathea maritus,Esset ut ipse tuus uellem - Galathea maritus,Esset ut ille tuus uellem - Galathea maritus,þat vilda ek Galathea at hann vǽri búandi þinn
303,364,Nec eadem uelles re bene si saperis,Hanc eciam uelles rem bene si saperes,Hec eadem uelles rem bene si saperes,Hec eadem uelles rem bene si saperes,ok þat sama myndir þú vilja ef þú vissir sem ek
304,365,Velle meum dixi - non tamen ipse rogat,Velle meum dixi sed non tamen ille rogauit,Velle meum dixi sed non tamen ille rogauit,Velle meum dixi sed non tamen ille rogauit,ok vilja minn sagða ek en ei bað ek hann þess mik
305,366,Vos sinit esse meum iudicat ingenium,Vos simul esse meum iudicat arbitrium,Vos simul esse meum iudicat arbitrium,Vos simul esse meum iudicat arbitrium,minn dómr dǿmir ykkr bǽði saman
306,367,Et genus et probitas et forma decens utriusque,Et genus et probitas et forma decens utriusque,Et genus et probitas et forma decens utriusque,Et genus et probitas et forma decens utriusque,kyn ok kostr hvárstveggja
307,368,Mecum cum sedunt uos simul esse duos,Mecum concedunt - uos simul esse duos,Mecum concedunt - uos simul esse duos,Mecum concedunt - uos simul esse duos,
308,369,Gracia modo uacuis deducimus ocia uerbis,Nostra modo uacuis deducimus ocia uerbis,Nostra modo uacuis deducimus ocia uerbis,Nostra tamen uacuis deducimus ocia uerbis,Nú hlýðum vit tómum orðum um stund
309,37,Nam solet amoto plus ledere proximus ignis,Nam solet amoto plus ledere proximus ignis,Nam solet amoto plus ledere proximus ignis,Nam solet amoto plus ledere proximus ignis,"því at
 eldr þyngir meir þeim er á liggr"
310,370,Res tamen interdum grandia parua mouent,Res tamen interdum grandia parua mouet,Res tamen interdum gaudia parua mouet,Res tamen interdum grandia parua mouet,"en oft koma
 stórmǽli af litlum hlut"
311,371,Et minima mafnus scintilla nascitur ignis,E minima mafnus scintilla nascitur ignis,E minima mafnus scintilla nascitur ignis,E minima mafnus scintilla nascitur ignis,mikill eldr verðr oft af litlum gneista
312,372,Et generat paruum grandia principium,Et generat paruum grandia principium,Et generat paruum grandia principium,Et generat paruum grandia principium,lítit upphaf gerir stundum ágǽtt niðrlag
313,373,Mens mea concepit harum primordia rerum,Mens mea concepit harum primordia rerum,Mens mea concepit harum primordia rerum,Mens mea concepit harum primordia rerum,hugr minn ǽtlaði með sér þetta upphaf þessa máls
314,374,Vtque nostris loqui cepimus - inde iocis,Atque loqui nostris cepimus - - ingenijs,Atque loqui nostris cepimus - inde iocis,Atque loqui nostris cepimus iocis uel ingenijs,ok því sneri ek minni rǿðu til þín í gamni mínu
315,375,Sed si rebus in hijs tua mens animusque mouetur,Sed nec rebus in hijs tua mens animusque mouetur,Sed si rebus in hijs tua mens animusque mouetur,Sed si rebus in hijs tua mens animusque mouetur,en ef hugr þinn eða hugskot kømsk nǫkkut við þessa rǿðu
316,376,Si placet an pocius displicet inde loqui,Si placet an pocius displicet inde loqui,Si placet an pocius displicet inde loqui,Si placet an pocius displicet inde loqui,
317,377,Deprecor ut dicas que dixeris ipsa tacebo,Deprecor ut dicas quod dixeris ipsa tacebo,Deprecor ut dicas quod dixeris ipsa tacebo,Deprecor ut dicas quod dixeris ipsa tacebo,
318,378,Si celare uelis siue referre loquar,Si celare uelis siue referre loquar,Si celare uelis siue referre loquar,Si celare uelis siue referre loquar,
319,379,Dic michi nec dubites stultum depone pudorem,Dic michi ne dubita stultum depone pudorem,Dic michi ne dubites stultum depone pudorem,Dic michi nec dubita stultum depone pudorem,
320,38,Ne si mota fotet lederet ipsa minus,Me si mota fotet lederet ipsa minus,Me si mota fotet lederet ipsa minus,Me si mota fotet lederet ipsa minus,en hinum er fjarri er
321,380,Hic uenit a sola rusticitate pudor,Nam uenit a sola rusticitate pudor,Hic uenit a sola rusticitate pudor,Hic uenit a sola rusticitate pudor,
322,381,Non michi rusticitas stultus modo nec pudor obstat,Non michi rusticitas stultus michi nec pudor obstat,Non michi rusticitas uultus michi nec pudor obstat,Non michi rusticitas stultus michi nec pudor obstat,Eigi veldr ónǿfrleikr ok engi heimskleikr
323,382,Sermo sed admiror quo uenit iste tuus,Sermo sed admiror quo uenit iste tuus,Sermo sed admiror quo uenit iste tuus,Sermo sed admiror quid uenit iste tuus,en hvaðan kom þér þessi rǿða
324,383,Huc miror si te casus transmisit an ille,Nunc miror si te casus transmisit an ille,Huc miror si te casus transmisit an ille,Huc miror si te casus transmisit an ille,hví þú komt hér eða
325,384,Pamphilus an querit premia sermo tuus,Pamphilus an querat premia sermo tuus,Pamphilus an querit premia sermo tuus,Pamphilus an querit premia sermo tuus,"sendi Pamphilus þik hingat eða sér rǿða þín til nǫkkurra ambuna
"
326,385,Sepe iniquorum scelus impedit acta bonorum,Semper iniquorum scelus impedit acta bonorum,Semper iniquorum scelus impedit acta bonorum,Semper iniquorum scelus impedit acta bonorum,Illska vándra manna spillir jafnan verkum góðra
327,386,Penas sepe luit quas homo non meruit,Penas sepe luit quas homo non meruit,Penas sepe luit quas homo non meruit,Penas sepe luit quas homo non meruit,ok oft geldr maðr þess er hann hefir ei gǫrt
328,387,Quamuis pauper ego non sic tibi premia quero,Quamuis pauper ego non sic michi premia quero,Quamuis paulisper ego non sic tibi premia quero,Quamuis pauper ego non sic - premia quero,en þó at ek sé fátǿk þá fǽ ek eigi þó svá mér fjár
329,388,Iam michi sufficiens est mea pauperies,Nam michi sufficiens est mea pauperies,Nam michi sufficiens est mea pauperies,Nam michi sufficiens est mea pauperies,því at ek á lítit þá er eigi mér lítit ǿrit
330,389,Primitus ut dixi mea mens conceperat istud,Primitus ut dixi mea mens conceperat istud,Primitus ut dixi mea mens conceperat istud,Primitus ut dixi mea mens conceperat istud,svá er þó sem ek sagða fyrst hugr minn hóf þetta
331,39,Fertur uicinis formosior omnibus illa,Fertur uicinis formosior omnibus illa,Fertur uicinis formosior omnibus illa,Fertur uicinis formosior omnibus illa,"því at þat er sagt at hon sé ein fegri ǫllum
 návistarkonum sínum"
332,390,nosti conscius omnis abest,Altera tu nosti conscius omnis abest,Alter dum nosti conscius omnis abest,Altera tu nosti conscius omnis abest,þú veizt með mér ok engi fleiri
333,391,Hoc satis esse potest si uos simul esse uelitis,Hoc satis esse potest si uos simul esse uelitis,Hoc satis esse potest si uos simul ambo uelitis,Hoc satis esse potest si uos simul esse uelitis,Þá má vel vera at þit séð bǽði saman ef þit vilið
334,392,Hoc et uterque potest absque pudore pati,Hoc et uterque potest absque pudore pati,Hoc et uterque potest absque pudore pati,Hoc et uterque potest absque pudore pati,"ok þá má hvárttveggja ykkart þola skammlaust
"
335,393,Nobilis ille quidem nec nobilis es minus ipsa,Nobilis ille quidem nec nobilis es minus ipsa,Nobilis ille quidem nec nobilis es minus ipsa,Nobilis ille quidem nec nobilis es minus ipsa,kyngǫfgaðr er hann ok eigi þú síðr
336,394,Est utriusque satis nota propago michi,Est utriusque satis nota propago michi,Est utriusque satis nota propago michi,Est utriusque satis nota propago michi,"fyrirmenn
 hvárstveggja eru mér kunnigir"
337,395,Pulcrior hic socijs - sociabus pulcrior ipsa,Pulcrior hic socijs - sociabus pulcrior ipsa,Pulcrior hic socijs - sociabus pulcrior ipsa,Pulcrior hic socijs uel sociabus pulcrior ipsa,hann er fríðari félagum en þú leikum ljósari
338,396,Cum specie species conuenit atque placet,Cum specie species conuenit atque placet,Cum species speciem conuenit atque placet,Cum specie species conuenit atque placet,fagrt við fǫgru líkar
339,397,Hoc utriusque probat par copia parque iuuentus,Hoc utriusque probat par copia parque iuuenta,Hic utriusque probat par copia parque iuuenta,Hoc utriusque probat par copia parque iuuentus,ok er auðr ǿrinn með yðr ok ok glǫð ǿska
340,398,Famaque si sciret ipsa probaret idem,Famaque si sciret ipsa probaret idem,Famaque si sciret ipsa probaret idem,Famaque si sciret ipsa probaret idem,ok sjǫlf myndi sanna fegrð frǽgð ef vissi
341,399,Quando pares estis sociari iure potestis,Quando pares estis sociari iure potestis,Quando pares estis sociari iure potestis,Quando pares estis sociari iure potestis,ok með því at þit eruð jǫfn þá megu þit með réttu félag eiga
342,4,Nec sinit aspectus plaga uidere suos,Nec sinit aspectus plaga uidere suos,Nec sinit aspectus plaga uidere suos,Nec sinit aspectus plaga uidere suos,ok ei lǽtr sjalft sár sýnask
343,40,Et me fallit  amor omnibus aut superest,Aut me fallit  amor omnibus aut superest,Aut me fallit  amor omnibus aut superest,Aut me fallit  amor omnibus aut superest,Annathvárt er at mik blekkir ást eða er hon ein yfir ǫllum
344,400,"Deficit in uobis nil nisi solus amor""","Deficit in uobis nil nisi solus amor""","Deficit in uobis nil nisi solus amor""","Deficit in uobis nil nisi solus amor""",ekki skortir með ykkr nema ást ein
345,401,Quod michi nunc dicis dici deberes amicis -,Quod michi nunc dicis timor impedit ipse parentum,Quod michi nunc dicis dici deberes amicis -,Quot michi nunc dicis dici deberet amicis -,Þat er þú mǽlir við mik þat skyldi mǽlt vera við frǽndr mína
346,402,Assensu quorum coniugis opto thorum,Assensu quorum coniugis opto thorum,Assensu quorum coniugis opto thorum,Assensu quorum coniugis opto thorum,ok með þeira ráði þá fýsumsk ek nú bónda hvílu
347,403,Vos prius alloquere uel tu uel Pamphilus ille,Hos prius alloquere uel tu uel Pamphilus ille,Hoc prius alloquere uel tu uel Pamphilus ille,Hos prius alloquere uel tu uel Pamphilus ille,mǽl þat við þá þú eða Pamphilus
348,404,"Res erit ad libitum pulcrior ista suum""","Res erit ad libitum pulcrior ista suum""","Res erit ad libitum pulcrior ista suum""","Res erit ad libitum pulcrior ista suum""",þá mun hlutr sjá fegri verða þó at hans vili verði
349,405,Conuenit ut tua sit consensum teda parentum,Conuenit ut tua sit consensu teda parentum,Conuenit ut tua sit concessu teda parentum,Conuenit ut tua sit consensu teda parentum,"Þat hǿfir at þitt ráð sé í samrǽði
 við frǽndr þína"
350,406,Sed tuus interea militet ignis ei,Sed tuus interea militet ignis ei,Sed tuus interea militet ignis ei,Sed tuus interea militet ignis ei,ok þín ást leiki meðan við hans ást
351,407,Exercet corda iuuenum Venus ingeniosa,Exercet corda iuuenum Venus ingeniosa,Exercet corda iuuenum Venus ingeniosa,Exercet corda iuuenum Venus ingeniosa,
352,408,Quisque per hoc studium colligit ingenium,Quisque per hoc studium colligit ingenium,Quisque per hoc studium colligit ingenium,Quisque per hoc studium colligit ingenium,ok hverr með sínu athygli sannar þessa íðn
353,409,Incitat hoc animos dat largis odit auaros,Incitat hec animos dat largius odit auaros,Incitat hec animos dat largis odit auaras,Incitat hec animos dat largos odit auaros,losti vekr hugskot manna
354,41,Nec mea transiecit certis precordia telis,Hec mea transiecit certis precordia telis,Hec mea transiecit certis precordia telis,Hec mea transiecit certis precordia telis,Sjá hefir gjǫgnum lostit mín innyfli vísu gaflaki
355,410,Leticiam sequitur tristiciamque fugit,Leticiam sequitur tristiciamque fugit,Leticiam sequitur tristiciamque fugit,Leticiam sequitur tristiciamque fugit,"ok sambundin ást fylgir gleði ok hatar hryggleik
"
356,411,Narraret nullus quantum Veneris ualet usus,Narraret nullus Veneris quantum ualet usus,Narraret nullus Veneris quantum ualet usus,Narraret nullus quantum Veneris ualet usus,engi man talt fá harm hans ok hryggleik
357,412,Huic nisi parueris rustica semper eris,Huic nisi parueris rustica semper eris,Huic nisi parueris rustica semper eris,Huic nisi parueris rustica semper eris,nema þú vǽgir elligar munt þú jafnan ónǿfr vera
358,413,"""Per Veneris morem uirgo cito perdit honorem","""Per Veneris morem uirgo cito perdit honorem","""Per Veneris morem uirgo cito perdit honorem","""Per Veneris morem uirgo cito perdit honorem",Með lostavenju tapar mǽr sama sínum brátt
359,414,Igneus ille furor nescit habere modum,Igneus ille furor nescit habere modum,Igneus ille furor nescit habere modum,Igneus ille furor nescit habere modum,því at sú eldlig ǿði kann eigi hóf hafa
